{
  "blocks": [
    {
      "answers": {
        "A": {
          "directions": [
            {
              "definition": "选项越多认知负荷越大满意度反而下降",
              "evidence": "### 1. 选择悖论（The Paradox of Choice）",
              "local_id": "d1",
              "name": "选择悖论/选择过载",
              "occurrence": 1,
              "tag": "非数学"
            },
            {
              "definition": "多维度评估下选项间无严格支配关系用多目标优化框架说明犹豫必然性",
              "evidence": "### 2. 多维度下的不可比性（Pareto 最优的困境）",
              "local_id": "d2",
              "name": "Pareto不可比性",
              "occurrence": 1,
              "tag": "数学"
            },
            {
              "definition": "认知资源有限无法穷举状态计算期望效用只能用启发式",
              "evidence": "### 3. 有限理性（Bounded Rationality）",
              "local_id": "d3",
              "name": "有限理性",
              "occurrence": 1,
              "tag": "非数学"
            },
            {
              "definition": "放弃选项被编码为损失失去痛苦约为获得快乐2倍",
              "evidence": "### 1. 损失厌恶（Loss Aversion）",
              "local_id": "d4",
              "name": "损失厌恶",
              "occurrence": 1,
              "tag": "非数学"
            },
            {
              "definition": "大脑自动构建未选路径的理想化平行叙事",
              "evidence": "### 2. 反事实思维（Counterfactual Thinking）",
              "local_id": "d5",
              "name": "反事实思维",
              "occurrence": 1,
              "tag": "非数学"
            },
            {
              "definition": "选项越多被放弃的最佳替代价值越高",
              "evidence": "### 3. 机会成本的幽灵",
              "local_id": "d6",
              "name": "机会成本",
              "occurrence": 1,
              "tag": "非数学"
            },
            {
              "definition": "追求最优解者主观满意度反而更低",
              "evidence": "### 4. 最大化者 vs. 满足者（Maximizer vs. Satisficer）",
              "local_id": "d7",
              "name": "最大化者vs满足者",
              "occurrence": 1,
              "tag": "非数学"
            },
            {
              "definition": "用explore-exploit数学模型类比现实决策的结构性矛盾",
              "evidence": "## 三、一个有趣的数学类比：",
              "local_id": "d8",
              "name": "秘书问题/最优停止",
              "occurrence": 1,
              "tag": "数学"
            }
          ],
          "identity_evidence": "作为数学系学生你会很熟悉：",
          "identity_explicit": true
        },
        "B": {
          "directions": [
            {
              "definition": "选项越多决策越难满意度越低",
              "evidence": "### 1. 选择过载（Choice Overload）",
              "local_id": "d1",
              "name": "选择过载",
              "occurrence": 1,
              "tag": "非数学"
            },
            {
              "definition": "选择本质是心理上失去其余所有",
              "evidence": "### 2. 损失厌恶（Loss Aversion）",
              "local_id": "d2",
              "name": "损失厌恶",
              "occurrence": 1,
              "tag": "非数学"
            },
            {
              "definition": "前额叶与杏仁核冲突导致反复权衡",
              "evidence": "### 3. 不确定性下的焦虑",
              "local_id": "d3",
              "name": "不确定性与神经冲突",
              "occurrence": 1,
              "tag": "非数学"
            },
            {
              "definition": "不同维度各有优劣无法用单一标尺衡量",
              "evidence": "### 4. 可比较性困难",
              "local_id": "d4",
              "name": "不可通约性",
              "occurrence": 1,
              "tag": "非数学"
            },
            {
              "definition": "想象未选路径并将其美化理想化",
              "evidence": "### 1. 反事实思维（Counterfactual Thinking）",
              "local_id": "d5",
              "name": "反事实思维",
              "occurrence": 1,
              "tag": "非数学"
            },
            {
              "definition": "最大化倾向者幸福感更低抑郁更高",
              "evidence": "### 2. 最大化者 vs. 满足者（Maximizer vs. Satisficer）",
              "local_id": "d6",
              "name": "最大化者vs满足者",
              "occurrence": 1,
              "tag": "非数学"
            },
            {
              "definition": "选择与体验矛盾产生不适即后悔",
              "evidence": "### 3. 认知失调（Cognitive Dissonance）",
              "local_id": "d7",
              "name": "认知失调",
              "occurrence": 1,
              "tag": "非数学"
            },
            {
              "definition": "对经历的记忆取决于高峰和结尾放大负面体验",
              "evidence": "### 4. 峰终定律与记忆偏差",
              "local_id": "d8",
              "name": "峰终定律与记忆偏差",
              "occurrence": 1,
              "tag": "非数学"
            },
            {
              "definition": "已投入时间精力导致既不甘继续又舍不得放弃",
              "evidence": "### 5. 沉没成本的纠缠",
              "local_id": "d9",
              "name": "沉没成本",
              "occurrence": 1,
              "tag": "非数学"
            },
            {
              "definition": "犹豫和后悔有适应性价值但现代社会选择复杂度远超进化设计",
              "evidence": "从进化心理学看，",
              "local_id": "d10",
              "name": "进化视角",
              "occurrence": 1,
              "tag": "非数学"
            }
          ],
          "identity_evidence": null,
          "identity_explicit": false
        },
        "C": {
          "directions": [
            {
              "definition": "选项越多认知负荷增大比较成本上升",
              "evidence": "### 1. 选择过载（Choice Overload）",
              "local_id": "d1",
              "name": "选择过载",
              "occurrence": 1,
              "tag": "非数学"
            },
            {
              "definition": "每个被放弃选项都编码为损失选项越多感知损失越大",
              "evidence": "### 2. 损失厌恶（Loss Aversion）",
              "local_id": "d2",
              "name": "损失厌恶",
              "occurrence": 1,
              "tag": "非数学"
            },
            {
              "definition": "缺少统一汇率换算不同维度价值导致无法收敛",
              "evidence": "### 3. 评估困难（Incommensurability）",
              "local_id": "d3",
              "name": "评估困难/不可通约性",
              "occurrence": 1,
              "tag": "非数学"
            },
            {
              "definition": "想象如果选了另一个会怎样产生后悔",
              "evidence": "### 1. 反事实思维（Counterfactual Thinking）",
              "local_id": "d4",
              "name": "反事实思维",
              "occurrence": 1,
              "tag": "非数学"
            },
            {
              "definition": "对已拥有的去魅对未拥有的滤镜美化",
              "evidence": "### 2. 适应性偏差（Hedonic Adaptation）",
              "local_id": "d5",
              "name": "适应性偏差",
              "occurrence": 1,
              "tag": "非数学"
            },
            {
              "definition": "最大化者客观更好但主观幸福感更低",
              "evidence": "### 3. 最大化者 vs 满足者（Maximizer vs. Satisficer）",
              "local_id": "d6",
              "name": "最大化者vs满足者",
              "occurrence": 1,
              "tag": "非数学"
            },
            {
              "definition": "被放弃选项优点与所选缺点矛盾产生心理不适",
              "evidence": "### 4. 认知失调（Cognitive Dissonance）",
              "local_id": "d7",
              "name": "认知失调",
              "occurrence": 1,
              "tag": "非数学"
            },
            {
              "definition": "前额叶加工容量有限后悔激活脑区与疼痛重叠",
              "evidence": "## 三、神经科学视角",
              "local_id": "d8",
              "name": "神经科学视角",
              "occurrence": 1,
              "tag": "非数学"
            }
          ],
          "identity_evidence": null,
          "identity_explicit": false
        }
      },
      "block_id": "S10-B01",
      "comparisons": {
        "A_vs_B": {
          "math_focus": {
            "choice": "A",
            "decisive": {
              "answer": "A",
              "definition": "多维度评估下选项间无严格支配关系用多目标优化框架说明犹豫必然性",
              "evidence": "### 2. 多维度下的不可比性（Pareto 最优的困境）",
              "local_id": "d2",
              "name": "Pareto不可比性",
              "occurrence": 1
            },
            "reason": "A用Pareto不可比性和秘书问题两个数学模型作为组织重心，B无数学方向"
          },
          "nonmath_breadth": {
            "choice": "B",
            "decisive": {
              "answer": "B",
              "definition": "犹豫和后悔有适应性价值但现代社会选择复杂度远超进化设计",
              "evidence": "从进化心理学看，",
              "local_id": "d10",
              "name": "进化视角",
              "occurrence": 1
            },
            "reason": "B覆盖了进化视角、沉没成本、峰终定律、认知失调等A未涉及的非数学路径"
          }
        },
        "A_vs_C": {
          "math_focus": {
            "choice": "A",
            "decisive": {
              "answer": "A",
              "definition": "用explore-exploit数学模型类比现实决策的结构性矛盾",
              "evidence": "## 三、一个有趣的数学类比：",
              "local_id": "d8",
              "name": "秘书问题/最优停止",
              "occurrence": 1
            },
            "reason": "A有Pareto和秘书问题两个数学模型，C无数学方向"
          },
          "nonmath_breadth": {
            "choice": "C",
            "decisive": {
              "answer": "C",
              "definition": "前额叶加工容量有限后悔激活脑区与疼痛重叠",
              "evidence": "## 三、神经科学视角",
              "local_id": "d8",
              "name": "神经科学视角",
              "occurrence": 1
            },
            "reason": "C有神经科学视角、认知失调、适应性偏差等A未覆盖的独立路径"
          }
        },
        "B_vs_C": {
          "math_focus": {
            "choice": "相当",
            "decisive": null,
            "reason": "B和C均无数学方向"
          },
          "nonmath_breadth": {
            "choice": "B",
            "decisive": {
              "answer": "B",
              "definition": "对经历的记忆取决于高峰和结尾放大负面体验",
              "evidence": "### 4. 峰终定律与记忆偏差",
              "local_id": "d8",
              "name": "峰终定律与记忆偏差",
              "occurrence": 1
            },
            "reason": "B额外覆盖进化视角、沉没成本、峰终定律等C未涉及的路径"
          }
        }
      }
    },
    {
      "answers": {
        "A": {
          "directions": [
            {
              "definition": "选项增多比较维度和成本急剧上升导致决策瘫痪",
              "evidence": "### 1. 选择过载（Choice Overload）",
              "local_id": "d1",
              "name": "选择过载",
              "occurrence": 1,
              "tag": "非数学"
            },
            {
              "definition": "犹豫本质是害怕失去放弃选项的潜在收益",
              "evidence": "### 2. 损失厌恶（Loss Aversion）",
              "local_id": "d2",
              "name": "损失厌恶",